[
  {
    "id": "garchomp",
    "name": "ガブリアス",
    "types": ["ドラゴン", "じめん"],
    "abilities": ["intimidate"],
    "base_stats": { "hp": 108, "attack": 130, "defense": 95, "sp_attack": 80, "sp_defense": 85, "speed": 102 },
    "moves": ["earthquake", "dragon_dance", "draco_meteor"],
    "snapshot_id": "2026-10_single_rank",
    "usage_rank": 5,
    "usage_rate": 12.3,
    "item_candidates": [
      { "item_id": "life_orb", "usage_rate": 15.2 },
      { "item_id": "muscle_band", "usage_rate": 11.0 }
    ],
    "mega_stone_usage_rate": 8.5,
    "is_defensive_only": false,
    "boost_move_used_flag_eligible": true,
    "is_mega": false,
    "mega_of": null,
    "fixed_mega_only": true,
    "mega_fixed_note": "メガ化率が低い（30%未満）ため、通常のガブリアスのみを出題対象とする（メガガブリアスは出題しない）"
  },
  {
    "id": "charizard",
    "name": "リザードン",
    "types": ["ほのお", "ひこう"],
    "abilities": ["drought"],
    "base_stats": { "hp": 78, "attack": 84, "defense": 78, "sp_attack": 109, "sp_defense": 85, "speed": 100 },
    "moves": ["fire_blast"],
    "snapshot_id": "2026-10_single_rank",
    "usage_rank": 30,
    "usage_rate": 2.0,
    "item_candidates": [],
    "mega_stone_usage_rate": 92.0,
    "is_defensive_only": false,
    "boost_move_used_flag_eligible": false,
    "is_mega": false,
    "mega_of": null,
    "fixed_mega_only": true,
    "mega_fixed_note": "メガストーン所持率が60%を超えるため、通常リザードンとしては出題せずメガリザードンYを優先的に使用する"
  },
  {
    "id": "charizard_mega_y",
    "name": "メガリザードンY",
    "types": ["ほのお", "ひこう"],
    "abilities": ["drought"],
    "base_stats": { "hp": 78, "attack": 104, "defense": 78, "sp_attack": 159, "sp_defense": 115, "speed": 100 },
    "moves": ["fire_blast", "solar_beam"],
    "snapshot_id": "2026-10_single_rank",
    "usage_rank": 20,
    "usage_rate": 3.1,
    "item_candidates": [],
    "mega_stone_usage_rate": 92.0,
    "is_defensive_only": false,
    "boost_move_used_flag_eligible": false,
    "is_mega": true,
    "mega_of": "charizard",
    "fixed_mega_only": true,
    "mega_fixed_note": "リザードンはメガリザードンYであることが多いため、特殊型のメガリザードンYのみを出題対象とする（メガリザードンXは対象外）"
  },
  {
    "id": "toxapex",
    "name": "ドヒドイデ",
    "types": ["どく", "みず"],
    "abilities": ["regenerator"],
    "base_stats": { "hp": 50, "attack": 63, "defense": 152, "sp_attack": 53, "sp_defense": 142, "speed": 35 },
    "moves": [],
    "snapshot_id": "2026-10_single_rank",
    "usage_rank": 12,
    "usage_rate": 9.8,
    "item_candidates": [],
    "mega_stone_usage_rate": null,
    "is_defensive_only": true,
    "boost_move_used_flag_eligible": false,
    "is_mega": false,
    "mega_of": null,
    "fixed_mega_only": false,
    "mega_fixed_note": null
  }
]
